{
  "schemaVersion": "zkme.portable-testcase.v1",
  "id": "TC-ZKME-SAMPLE-001",
  "title": "Sample portable testcase skeleton",
  "risk": "low",
  "executionModes": [
    "direct-portable-runner-adapter"
  ],
  "targets": [
    "manual",
    "zeuz"
  ],
  "evidence": [
    "Generated by ZKME scaffold as a safe starter example"
  ],
  "steps": [
    {
      "id": "step-001",
      "stepKey": "step-001",
      "stepName": "Sample manual starter step",
      "intent": "Record a manual starter step",
      "adapter": "manual",
      "action": "manual candidate",
      "expected": "Replace this sample with project-specific Playwright, API, DB, mobile, desktop, or ZeuZ-compatible steps.",
      "zeuzMapping": {
        "stepKey": "step-001",
        "stepName": "Sample manual starter step",
        "stepSequence": 1,
        "stepId": 1,
        "actionType": "manual",
        "actionLabel": "manual candidate",
        "actionName": "manual candidate",
        "rows": []
      }
    }
  ]
}
